{
  "intent_sha256": "591cfd6ec57d40bb3467a543a94091e2d3747c1db94407aa3b1d603193960275",
  "result": "collar",
  "schema_version": "plan.v1",
  "steps": [
    {
      "at_mm": [
        10,
        10,
        0
      ],
      "height_mm": 10,
      "id": "ring",
      "op": "cylinder",
      "radius_mm": 10
    },
    {
      "at_mm": [
        10,
        10,
        -1
      ],
      "height_mm": 12,
      "id": "bore",
      "op": "cylinder",
      "radius_mm": 4.1
    },
    {
      "at_mm": [
        -1,
        10,
        5
      ],
      "axis": "x",
      "height_mm": 5,
      "id": "tap",
      "op": "cylinder",
      "radius_mm": 1.25
    },
    {
      "from": "ring",
      "id": "collar",
      "op": "cut",
      "tools": [
        "bore",
        "tap"
      ]
    }
  ],
  "units": "mm"
}
